doi,url,author,year,title,articleType,sourceTitle,base,abstract,keywords
https://doi.org/10.1016/j.compag.2021.106298,https://www.sciencedirect.com/science/article/pii/S016816992100315X,Érika Akemi Saito Moriya and Nilton Nobuhiro Imai and Antonio Maria Garcia Tommaselli and Adilson Berveglieri and Guilherme Henrique Santos and Márcio Augusto Soares and Marcelo Marino and Thiago Tiedtke Reis,2021,Detection and mapping of trees infected with citrus gummosis using UAV hyperspectral data,article,Computers and Electronics in Agriculture,ScienceDirect,"Monitoring citrus diseases and pests in early stages is fundamental to ensure the efficiency of phytosanitary control and plant health. The various diseases caused by fungi, bacteria, viruses, and pests limit citrus production. Citrus gummosis disease, caused by the fungus Phytophthora spp., is the main fungal disease of citrus in Brazil. The lesions caused to the trunk and roots by Phytophthora spp. lead losses in production, foot and root rot, brown fruit rot, canopy discoloration and leaf yellowing. Remote sensing is a nondestructive detection technology, that has been used to detect phytosanitary problems in agricultural crops. Multi and hyperspectral sensors on board unmanned aerial vehicles (UAVs) have been extensively applied in agriculture. In this study, the capability for the detection of citrus gummosis was evaluated in two data sets. The first one considered hyperspectral images acquired with a 25 band sensor covering a spectral range from 500 nm to 840 nm, and the second data set was a simulated 3 band of multispectral sensor. The results indicated a better performance for the detection of citrus gummosis with the hyperspectral images than with three bands multispectral images. The high dimensionality of the hyperspectral data and the detailed spectral information allowed a more accurate classification of citrus gummosis infected plants. The classification maps were validated with field data and achieved an accuracy of 0.79 (F-score = 0.55) for the health map produced with multispectral data and an accuracy of 0.94 (F-score = 0.85) for the health map produced by the hyperspectral data.",Citrus gummosis; Remote sensing; Precision agriculture; Health map
10.3390/ijerph19010437,https://www.mdpi.com/1660-4601/19/1/437,"Szurgacz, Dawid and Zhironkin, Sergey and PokornÃ½, JiÅ™Ã­ and Spearing, A. J. S. (Sam) and VÃ¶th, Stefan and CehlÃ¡r, Michal and Kowalewska, Izabela",2022,Development of an Active Training Method for Belt Conveyor,article,International Journal of Environmental Research and Public Health,MDPI,"The global situation related to the COVID-19 pandemic has forced employers to find an adequate way to conduct training in order to ensure work safety. The underground mining industry is one of the industries which, due to its nature, was not able to switch to remote work. Conducting traditional training risked spreading the virus among workers. For this purpose, it was necessary to start a search for a form of training that would be safe and would not cause additional stress for employees. Research on the development of an active employee training method and testing of the method itself was conducted online. In order to develop a method of active training, one of the most important workstations was selected, which is the operation of the conveyor belt. The training method comprises four training modules. The modules cover questions related to the operation of the conveyor belt, emergencies, its assembly and disassembly, repair and maintenance. The developed issues also take into account questions concerning natural hazards and work safety. The entire training course lasts 10 days. Every day, an employee receives a set of eight questions sent to their email address, which they must answer before starting work. The article describes the methodology and implementation of the training.",occupational stress; work safety; human factor; active training method; underground mining
10.1109/IGARSS.2019.8897854,10.1109/IGARSS.2019.8897854,"Delgado, Cristhian and Benitez, Hernan and Cruz, Maribel and Selvaraj, Michael",2019,Digital Disease Phenotyping,inproceedings,IGARSS 2019 - 2019 IEEE International Geoscience and Remote Sensing Symposium,IEEE,"Precise and rapid methods of plant disease detection and evaluation are key factors to accelerate resistant variety development in the rice breeding program. Conventional methods for the disease detection and evaluation is mainly carried out using standard visual estimation by trained experts which is slow and prone to high level of subjectivity. Rigorous research has recently recognized innovative, sensor-based methods for the detection and evaluation of plant diseases. Among different type of sensors, aerial multispectral imaging provides a fast and nondestructive way of scanning plants in diseased regions and has been used by various researchers to classify symptom levels on the spectral profile of a plant. In this paper, we developed machine learning models to classify rice breeding lines infected by rice Hoja Blanca virus (RHBV) using multispectral images collected from UAV (unmanned aerial vehicle). Our results revealed that, the Support Vector Machine (SVM) and Random Forest (RF) methods were not significantly different in their ability to separate susceptible from non-susceptible classes, but SVM best classifiers showed a better sensitivity rates 0.74 (SVM) versus 0.71 (RF). The tool developed from this study will allow rice breeders to characterize Hoja Blanca virus resistant varieties considerably earlier, and subsequent in reduced costs.",Calibration;Diseases;Cameras;Feature extraction;Unmanned aerial vehicles;Immune system;Viruses (medical);Machine Learning (ML);Unmaned Aerial Vehicle (UAV);Rice Hoja Blanca Virus (RHBV);Hight Troughtput Phenotyping (HTP)
10.1109/JIOT.2020.3044966,10.1109/JIOT.2020.3044966,"Chamola, Vinay and Hassija, Vikas and Gupta, Sakshi and Goyal, Adit and Guizani, Mohsen and Sikdar, Biplab",2021,Disaster and Pandemic Management Using Machine Learning: A Survey,article,IEEE Internet of Things Journal,IEEE,"This article provides a literature review of state-of-the-art machine learning (ML) algorithms for disaster and pandemic management. Most nations are concerned about disasters and pandemics, which, in general, are highly unlikely events. To date, various technologies, such as IoT, object sensing, UAV, 5G, and cellular networks, smartphone-based system, and satellite-based systems have been used for disaster and pandemic management. ML algorithms can handle multidimensional, large volumes of data that occur naturally in environments related to disaster and pandemic management and are particularly well suited for important related tasks, such as recognition and classification. ML algorithms are useful for predicting disasters and assisting in disaster management tasks, such as determining crowd evacuation routes, analyzing social media posts, and handling the post-disaster situation. ML algorithms also find great application in pandemic management scenarios, such as predicting pandemics, monitoring pandemic spread, disease diagnosis, etc. This article first presents a tutorial on ML algorithms. It then presents a detailed review of several ML algorithms and how we can combine these algorithms with other technologies to address disaster and pandemic management. It also discusses various challenges, open issues and, directions for future research.",Pandemics;Prediction algorithms;Machine learning algorithms;Machine learning;Internet of Things;COVID-19;Disaster management;Crowd evacuation;disaster management;healthcare;machine learning (ML);pandemic management;social distancing
10.3390/drones6010015,https://www.mdpi.com/2504-446X/6/1/15,"RestÃ¡s, Ãgoston",2022,Drone Applications Fighting COVID-19 Pandemic&mdash;Towards Good Practices,article,Drones,MDPI,"Of the recent epidemics, the impact of the COVID-19 pandemic has been particularly severe, not only putting our health at risk, but also negatively affecting our daily lives. As there are no developed algorithms for the use of drones in epidemiological situations, it is ideal to analyze the experience gained on drones so far and outline the effective methods for future good practice. The author relies on a method of analyzing widely available open information, such as images and videos available on the Internet, reports from drone users, announcements by drone manufacturers and the contents of newspaper articles. Furthermore, the author has relied on the results of the relevant literature, as well as previous experience as a drone user and fire commander. The study reveals numerous possibilities associated with drone usage in epidemic related situations, but previous applications are based on previous experience gained during a non-epidemic situation, without developed algorithms. Applications can be divided into different types of groups: drones can collect data for management and provide information to the public, perform general or special logistical tasks to support health care and disinfect to reduce the risk of spreading the epidemic.",drone; COVID-19; area surveillance; thermal camera; loudspeaker; disinfection
10.3390/s21030742,https://www.mdpi.com/1424-8220/21/3/742,"Nguyen, Canh and Sagan, Vasit and Maimaitiyiming, Matthew and Maimaitijiang, Maitiniyazi and Bhadra, Sourav and Kwasniewski, Misha T.",2021,Early Detection of Plant Viral Disease Using Hyperspectral Imaging and Deep Learning,article,Sensors,MDPI,"Early detection of grapevine viral diseases is critical for early interventions in order to prevent the disease from spreading to the entire vineyard. Hyperspectral remote sensing can potentially detect and quantify viral diseases in a nondestructive manner. This study utilized hyperspectral imagery at the plant level to identify and classify grapevines inoculated with the newly discovered DNA virus grapevine vein-clearing virus (GVCV) at the early asymptomatic stages. An experiment was set up at a test site at South Farm Research Center, Columbia, MO, USA (38.92 N, &minus;92.28 W), with two grapevine groups, namely healthy and GVCV-infected, while other conditions were controlled. Images of each vine were captured by a SPECIM IQ 400&ndash;1000 nm hyperspectral sensor (Oulu, Finland). Hyperspectral images were calibrated and preprocessed to retain only grapevine pixels. A statistical approach was employed to discriminate two reflectance spectra patterns between healthy and GVCV vines. Disease-centric vegetation indices (VIs) were established and explored in terms of their importance to the classification power. Pixel-wise (spectral features) classification was performed in parallel with image-wise (joint spatial&ndash;spectral features) classification within a framework involving deep learning architectures and traditional machine learning. The results showed that: (1) the discriminative wavelength regions included the 900&ndash;940 nm range in the near-infrared (NIR) region in vines 30 days after sowing (DAS) and the entire visual (VIS) region of 400&ndash;700 nm in vines 90 DAS; (2) the normalized pheophytization index (NPQI), fluorescence ratio index 1 (FRI1), plant senescence reflectance index (PSRI), anthocyanin index (AntGitelson), and water stress and canopy temperature (WSCT) measures were the most discriminative indices; (3) the support vector machine (SVM) was effective in VI-wise classification with smaller feature spaces, while the RF classifier performed better in pixel-wise and image-wise classification with larger feature spaces; and (4) the automated 3D convolutional neural network (3D-CNN) feature extractor provided promising results over the 2D convolutional neural network (2D-CNN) in learning features from hyperspectral data cubes with a limited number of samples.",plant disease; spectral statistics; machine learning; 2D-CNN; 3D-CNN; grapevine vein-clearing virus (GVCV)
https://doi.org/10.1016/j.compag.2019.105066,https://www.sciencedirect.com/science/article/pii/S0168169919304089,Qing Gu and Li Sheng and Tianhao Zhang and Yuwen Lu and Zhijun Zhang and Kefeng Zheng and Hao Hu and Hongkui Zhou,2019,Early detection of tomato spotted wilt virus infection in tobacco using the hyperspectral imaging technique and machine learning algorithms,article,Computers and Electronics in Agriculture,ScienceDirect,"The hyperspectral imaging technique was used for the non-destructive detection of tomato spotted wilt virus (TSWV) infection in tobacco at an early stage. Spectra ranging from 400 to 1000 nm with 128 bands from inoculated and healthy tobacco plants were analyzed by using three wavelength selection methods (successive projections algorithm (SPA), boosted regression tree (BRT), and genetic algorithm (GA)), and four machine learning (ML) techniques (boosted regression tree (BRT), support vector machine (SVM), random forest (RF), and classification and regression tress (CART)). The results indicated that the models built by the BRT algorithm using the wavelengths selected by SPA as the input variables obtained the best outcome for the 10-fold cross-validation with the mean overall accuracy of 85.2% and area under receiver operating curve (AUC) of 0.932. The band selection results and variable contribution analysis in BRT modeling jointly showed that the near-infrared (NIR) spectral region is informative and important for the differentiation of infected and healthy tobacco leaves. Different stages of post-inoculation were split according to the molecular identification and visual observation. The classification results at different stages indicated that the hyperspectral imaging data combined with ML methods and wavelength selection algorithms can be used for the early detection of TSWV in tobacco, both at the presymptomatic stage and during the period before the systematic infection can be detected by the molecular identification approach.",Tobacco plants; Tomato spotted wilt virus; Presymptomatic detection; Hyperspectral imaging; Machine learning
https://doi.org/10.1016/j.scs.2021.103311,https://www.sciencedirect.com/science/article/pii/S2210670721005874,Muhammad Adil and Muhammad Khurram Khan,2021,Emerging IoT Applications in Sustainable Smart Cities for COVID-19: Network Security and Data Preservation Challenges with Future Directions,article,Sustainable Cities and Society,ScienceDirect,"COVID-19 is a global infectious disease that can be easily spread by the contiguity of infected people. To prevent from COVID-19 and reduce its impact in sustainable smart cities, the global research communities are working relentlessly by harnessing the emerging technologies to develop the safest diagnosis, evaluation, and treatment procedures, and Internet of Things (IoT) is one of the pioneers among them. IoT can perform a pivotal role to diminish its immense contagious rate by suitable utilization in emerging healthcare IoT applications in sustainable smart cities. Therefore, the focus of this paper is to outline a survey of the emerging healthcare IoT applications practiced in the perspective of COVID-19 pandemic in terms of network architecture security, trustworthiness, authentication, and data preservation followed by identifying existing challenges to set the future research directions. The salient contributions of this work deal with the accomplishment of a detailed and comprehensive literature review of COVID-19 starting from 2019 through 2021 in the context of emerging healthcare IoT technology. In addition, we extend the correlated contributions of this work by highlighting the weak aspects of the existing emerging healthcare IoT applications, security of different network layers and secure communication environment followed by some associated requirements to address these challenges. Moreover, we also identify future research directions in sustainable smart cities for emerging healthcare IoT utilization in the context of COVID-19 with the most productive results and least network implementation costs.",Emerging IoT applications for COVID-19; Sustainable smart cities; Network architecture security; Security and data preservation challenges
https://doi.org/10.1016/j.iot.2020.100342,https://www.sciencedirect.com/science/article/pii/S2542660520301736,Deepti Gupta and Smriti Bhatt and Maanak Gupta and Ali Saman Tosun,2021,Future Smart Connected Communities to Fight COVID-19 Outbreak,article,Internet of Things,ScienceDirect,"Internet of Things (IoT) has grown rapidly in the last decade and continues to develop in terms of dimension and complexity, offering a wide range of devices to support a diverse set of applications. With ubiquitous Internet, connected sensors and actuators, networking and communication technology along with artificial intelligence (AI), smart cyber-physical systems (CPS) provide services rendering assistance and convenience to humans in their daily lives. However, the recent outbreak of COVID-19 (also known as coronavirus) pandemic has exposed and highlighted the limitations of contemporary technological deployments especially to contain the widespread of this disease. IoT and smart connected technologies together with data-driven applications can play a crucial role not only in the prevention, mitigation, or continuous remote monitoring of patients, but also enable prompt enforcement of guidelines, rules, and administrative orders to contain such future outbreaks. In this paper, we envision an IoT and data-supported connected ecosystem designed for intelligent monitoring, pro-active prevention and control, and mitigation of COVID-19 and similar epidemics. We propose a gamut of synergistic applications and technology systems for various smart infrastructures including E-Health, smart home, supply chain management, transportation, and city, which will work in convergence to develop ‘pandemic-proof’ future smart communities. We also present a generalized cloud-enabled IoT implementation framework along with scientific solutions, which can be adapted and extended to deploy smart connected ecosystem scenarios using widely used Amazon Web Services (AWS) cloud infrastructures. In addition, we also implement an E-Health RPM use case scenario to demonstrate the need and practicality for smart connected communities. Finally, we highlight challenges and research directions that need thoughtful consideration and across the board cooperation among stakeholders to build resilient communities against future pandemics.",COVID-19; Coronavirus; Internet of things; Cloud computing; Edge computing; Artificial intelligence (AI); Machine learning; Smart communities; Multi-layered architecture; Security; Privacy
10.3390/ijgi10090602,https://www.mdpi.com/2220-9964/10/9/602,"Carballada, Angel Miramontes and Balsa-Barreiro, Jose",2021,Geospatial Analysis and Mapping Strategies for Fine-Grained and Detailed COVID-19 Data with GIS,article,ISPRS International Journal of Geo-Information,MDPI,"The unprecedented COVID-19 pandemic is showing dramatic impact across the world. Public health authorities attempt to fight against the virus while maintaining economic activity. In the face of the uncertainty derived from the virus, all the countries have adopted non-pharmaceutical interventions for limiting the mobility and maintaining social distancing. In order to support these interventions, some health authorities and governments have opted for sharing very fine-grained data related with the impact of the virus in their territories. Geographical science is playing a major role in terms of understanding how the virus spreads across regions. Location of cases allows identifying the spatial patterns traced by the virus. Understanding these patterns makes controlling the virus spread feasible, minimizes its impact in vulnerable regions, anticipates potential outbreaks, or elaborates predictive risk maps. The application of geospatial analysis to fine-grained data must be urgently adopted for optimal decision making in real and near-real time. However, some aspects related to process and map sensitive health data in emergency cases have not yet been sufficiently explored. Among them include concerns about how these datasets with sensitive information must be shown depending on aspects related to data aggregation, scaling, privacy issues, or the need to know in advance the particularities of the study area. In this paper, we introduce our experience in mapping fine-grained data related to the incidence of the COVID-19 during the first wave in the region of Galicia (NW Spain), and after that we discuss the mentioned aspects.",2019-nCoV; COVID-19; data privacy; disease mapping; geographic Information systems; geospatial analysis; SARS-CoV-2; spatial patterns; territorial impact
https://doi.org/10.1016/j.eswa.2021.114920,https://www.sciencedirect.com/science/article/pii/S0957417421003614,Soheyl Khalilpourazari and Hossein {Hashemi Doulabi} and Aybike {Özyüksel Çiftçioğlu} and Gerhard-Wilhelm Weber,2021,Gradient-based grey wolf optimizer with Gaussian walk: Application in modelling and prediction of the COVID-19 pandemic,article,Expert Systems with Applications,ScienceDirect,"This research proposes a new type of Grey Wolf optimizer named Gradient-based Grey Wolf Optimizer (GGWO). Using gradient information, we accelerated the convergence of the algorithm that enables us to solve well-known complex benchmark functions optimally for the first time in this field. We also used the Gaussian walk and Lévy flight to improve the exploration and exploitation capabilities of the GGWO to avoid trapping in local optima. We apply the suggested method to several benchmark functions to show its efficiency. The outcomes reveal that our algorithm performs superior to most existing algorithms in the literature in most benchmarks. Moreover, we apply our algorithm for predicting the COVID-19 pandemic in the US. Since the prediction of the epidemic is a complicated task due to its stochastic nature, presenting efficient methods to solve the problem is vital. Since the healthcare system has a limited capacity, it is essential to predict the pandemic's future trend to avoid overload. Our results predict that the US will have almost 16 million cases by the end of November. The upcoming peak in the number of infected, ICU admitted cases would be mid-to-end November. In the end, we proposed several managerial insights that will help the policymakers have a clearer vision about the growth of COVID-19 and avoid equipment shortages in healthcare systems.",COVID-19; Pandemic modeling; Grey wolf optimizer; Gradient search
https://doi.org/10.1016/j.landusepol.2020.105070,https://www.sciencedirect.com/science/article/pii/S0264837720315702,Małgorzata Renigier-Biłozor and Sabina Źróbek and Marek Walacik and Artur Janowski,2020,Hybridization of valuation procedures as a medicine supporting the real estate market and sustainable land use development during the covid-19 pandemic and afterwards,article,Land Use Policy,ScienceDirect,"Currently we are facing the pandemic situation that occur all over the world. Regardless the country or even the region, the negative consequences that are expected could be very big and the level of crisis is not predictable. This situation is the challenge for the real estate market as well. Due to this fact, the authors believe that there is the time when deep transformation of approaches, procedures and awareness related to valuation domain becomes. Today, due to the fact of the global COVID-19 and pandemic restrictions is the best time to implement the automated models and advanced technological solutions to the valuation world. The authors proposed the hybrid approach that is the way to reconcile the participants on the property market. Hybrid approach is understanding as the synergy in combining aspects of new (automated solutions) and traditional components that are developed in the agile mode system creation. The proposed solutions can be treated as a cure for some symptoms of the real estate market infection but also as a vaccine, which should to a large extent prevent restrictions and nuisance in real estate valuation in case of repeated infection.",Real estate market infection; Hybridization of valuation procedures; Remote technology
